{
  "summary": "The scenario becomes a public catalyst retirement evidence kit.",
  "generated_text": "Artifact: a sealed catalyst retirement evidence kit containing a cartridge sleeve, residue color strip, QR batch label, and resident-readable inspection slip.\n\nUse scene: a resident handles the kit at a municipal energy office while a technician explains why the cartridge was retired.\n\nImplied world rules: catalyst trust requires public evidence; biological materials in infrastructure must leave legible traces; maintenance has become civic communication.\n\nCritical question: does this artifact create public agency, or only translate expert authority into a more polite form?",
  "image_prompt": "Realistic documentary photo of a municipal energy counter with a sealed catalyst retirement evidence kit, residue color strip, QR batch label, and inspection slip, plain black and white document aesthetics.",
  "semantic_summary": "A public evidence kit that materializes the governance of speculative catalyst infrastructure.",
  "discussion_questions": [
    "What evidence can non-experts meaningfully inspect?",
    "Who decides when an artifact has explained enough?"
  ],
  "source_trace": [
    "Artifact details derive from the catalyst cartridge retirement scenario."
  ]
}
